hotel_id,city,hotel_name,url,score,number_of_reviews,description,property_type,latitude,longitude,price,currency,facilities,image_url
Cassis_6,Cassis,Le Bosquet,https://www.booking.com/hotel/fr/le-bosquet-cassis1.html?checkin=2025-12-11&checkout=2025-12-13&group_adults=2&no_rooms=1&group_children=,9.3,26,"Le Bosquet is located in Cassis, just 12 miles from Rond-Point du Prado Metro Station and 12 miles from Marseille Chanot Exhibition and Convention Center. With free private parking, the property is a 7-minute walk from Grande Mer and 12 miles from Orange Velodrome Stadium. Notre Dame de la Garde Basilica is 14 miles away and Saint-Ferreol Street is 14 miles from the apartment.

Featuring a balcony and sea views, the apartment includes 2 bedrooms, a living room, flat-screen TV, an equipped kitche",APARTMENT,43.2178808,5.53613129999997,323.0,USD,"Non-smoking rooms, Free parking, Terrace, Non-smoking rooms, Free parking",https://cf.bstatic.com/xdata/images/hotel/square60/107617941.jpg?k=cc1252fb9e1cdb0915c4e22d823a2808a9199d397aec91ac6a094a4b4183ae6b&o=
Cassis_7,Cassis,charmant T2 centre cassis avec parking,https://www.booking.com/hotel/fr/charmant-t2-centre-cassis-avec-parking.html?checkin=2025-12-11&checkout=2025-12-13&group_adults=2&no_rooms=1&group_children=&chal_t=1762886571338&force_referer=,8.3,14,"Offering a garden, charmant T2 centre cassis avec parking provides accommodations in Cassis. The property is around a 5-minute walk from Grande Mer, 12 miles from Orange Velodrome Stadium, and 12 miles from Rond-Point du Prado Metro Station. The apartment offers both free Wifi and free private parking.

With direct access to a terrace with garden views, the air-conditioned apartment consists of 1 bedroom. The accommodation is non-smoking.

Marseille Chanot Exhibition and Convention Center is 13 ",APARTMENT,43.2121229,5.5411663,294.0,USD,"Non-smoking rooms, Free Wifi, Free parking, Terrace, Garden",https://cf.bstatic.com/xdata/images/hotel/square60/595225549.jpg?k=6d746820f78df7983411d1d62550c1745f3740ec62cd12cd19a757380400d6c7&o=
Cassis_8,Cassis,Au cœur de Cassis,https://www.booking.com/hotel/fr/au-coeur-de-cassis-cassis3.html?checkin=2025-12-11&checkout=2025-12-13&group_adults=2&no_rooms=1&group_children=,8.7,18,"Au cœur de Cassis is located in Cassis, just 12 miles from Orange Velodrome Stadium and 12 miles from Rond-Point du Prado Metro Station. The air-conditioned accommodation is a 4-minute walk from Grande Mer. Marseille Chanot Exhibition and Convention Center is 12 miles from the apartment and La Timone Metro Station is 13 miles away.

With free Wifi, this 1-bedroom apartment features a flat-screen TV, a washing machine, and a fully equipped kitchen with an oven and microwave. Towels and bed linen ",APARTMENT,43.2149587,5.5399611,319.0,USD,"Non-smoking rooms, Free Wifi, Family rooms, Non-smoking rooms, Free Wifi",https://cf.bstatic.com/xdata/images/hotel/square60/594664063.jpg?k=97ce9396247c05025578ea7662f807a4490e020cf2940caded427d0909c1a88d&o=
Cassis_9,Cassis,Home Cassis - Maison Julou - Piscine chauffée à 32c,https://www.booking.com/hotel/fr/home-cassis-maison-julou.html?checkin=2025-12-11&checkout=2025-12-13&group_adults=2&no_rooms=1&group_children=,8.7,155,"Offering mountain views, Home Cassis - Maison Julou - Piscine chauffée à 32c in Cassis features accommodations, an outdoor swimming pool, a casino, and a garden. There's a private entrance at the apartment for the convenience of those who stay. The apartment offers rooms with air conditioning, free private parking, and free Wifi.

Each unit features a terrace, a fully equipped kitchen with a microwave, a dining area, and a flat-screen TV, while the private bathroom includes a shower and a hair d",APARTMENT,43.222079689063,5.537926946033,170.0,USD,"Outdoor swimming pool, Non-smoking rooms, Free Wifi, Free parking, Family rooms",https://cf.bstatic.com/xdata/images/hotel/max200/366628056.jpg?k=773e0abc4955bbd39af15a91c447239ffb97d4ef38b2c36dd04d60e74dd0a7e5&o=
Cassis_10,Cassis,Home Cassis - Maison Méditerranée - Piscine chauffée à 30c,https://www.booking.com/hotel/fr/home-cassis-maison-mediterrannee.html?checkin=2025-12-11&checkout=2025-12-13&group_adults=2&no_rooms=1&group_children=&chal_t=1762887271528&force_referer=,8.5,249,"A good location for a stress-free stay in Cassis, Home Cassis - Maison Méditerranée - Piscine chauffée à 30c is a vacation home surrounded by views of the sea. The property features an infinity pool, casino, and parking on-site among other facilities. This beachfront property offers access to a balcony, table tennis, and free Wifi. Guests can use the solarium or enjoy mountain views.

Each unit features a terrace, a fully equipped kitchen with a microwave, a dining area, and a flat-screen TV, wh",HOLIDAY_HOME,43.219776350851,5.53745873272419,324.0,USD,"Outdoor swimming pool, Non-smoking rooms, Free Wifi, Beachfront, Free parking",https://cf.bstatic.com/xdata/images/hotel/max200/302027124.jpg?k=86d2290b5062fa53e7e6e60f38a5f5e7c570a2ded1410a51f3bf3abb1c4ae582&o=
Cassis_11,Cassis,La Cassy - Sleep in Cassis,https://www.booking.com/hotel/fr/sleep-in-cassis.html?checkin=2025-12-11&checkout=2025-12-13&group_adults=2&no_rooms=1&group_children=&chal_t=1762887651560&force_referer=,8.8,129,"La Cassy - Sleep in Cassis is located in Cassis, just 12 miles from Orange Velodrome Stadium and 12 miles from Rond-Point du Prado Metro Station. The property is around 13 miles from Marseille Chanot Exhibition and Convention Center, 13 miles from La Timone Metro Station, and 14 miles from Castellane Metro Station. Free Wifi is available throughout the property and Grande Mer is a 4-minute walk away.

The air-conditioned apartment consists of 1 bedroom, a living room, a fully equipped kitchen wi",APARTMENT,43.21351434634,5.539700449428,240.0,USD,"Non-smoking rooms, Free Wifi, Non-smoking rooms, Free Wifi",https://cf.bstatic.com/xdata/images/hotel/square60/645613151.jpg?k=ff6658e3e6f35b51454d941bcc1f34f551c2c0804832a73c58c40f481da53cb4&o=
Cassis_12,Cassis,La Cigale du Port,https://www.booking.com/hotel/fr/le-roucas-cassis.html?checkin=2025-12-11&checkout=2025-12-13&group_adults=2&no_rooms=1&group_children=,9.0,48,"La Cigale du Port is located in Cassis, just a 8-minute walk from Grande Mer and 12 miles from Orange Velodrome Stadium. Both free Wifi and parking on-site are accessible at the apartment free of charge. Rond-Point du Prado Metro Station is 12 miles from the apartment and Marseille Chanot Exhibition and Convention Center is 12 miles away.

The air-conditioned apartment consists of 2 bedrooms, a living room, a fully equipped kitchen with a dishwasher and a coffee machine, and 1 bathroom with a ba",APARTMENT,43.2177957,5.5358322,277.0,USD,"Non-smoking rooms, Free Wifi, Free parking, Non-smoking rooms, Free Wifi",https://cf.bstatic.com/xdata/images/hotel/square60/479525397.jpg?k=5a105c68ba0eea7c8d8ba3413d6476aa8ba203bc9218bfeaec0b4c4e19ea0b11&o=
Cassis_13,Cassis,Appartement le Quai du Port Cassis parking clim,https://www.booking.com/hotel/fr/appartement-le-quai-du-port-cassis-parking-clim.html?checkin=2025-12-11&checkout=2025-12-13&group_adults=2&no_rooms=1&group_children=,9.3,138,"Appartement le Quai du Port Cassis parking clim offers accommodations in Cassis, a 5-minute walk from Grande Mer and 12 miles from Orange Velodrome Stadium. This beachfront property offers access to a terrace, free private parking, and free Wifi. The accommodation features a 24-hour front desk and an ATM for guests.

The air-conditioned apartment consists of 1 bedroom, a living room, a fully equipped kitchen with a dishwasher and a coffee machine, and 1 bathroom with a walk-in shower and a hair ",APARTMENT,43.2148357,5.5360761,292.0,USD,"Non-smoking rooms, Airport shuttle, Free Wifi, Beachfront, Free parking",https://cf.bstatic.com/xdata/images/hotel/square60/320842654.jpg?k=c57cf097b961c909c38c9d5718b76072217d9dee5f1edffe76fd94e3281254bb&o=
Cassis_14,Cassis,Cassis centre,https://www.booking.com/hotel/fr/cassis-centre-cassis.html?checkin=2025-12-11&checkout=2025-12-13&group_adults=2&no_rooms=1&group_children=,7.5,75,"Within a 3-minute walk of Grande Mer and 12 miles of Orange Velodrome Stadium, Cassis centre provides free Wifi and a private beach area. The property is around 12 miles from Rond-Point du Prado Metro Station, 12 miles from Marseille Chanot Exhibition and Convention Center, and 13 miles from Castellane Metro Station. Saint-Ferreol Street is 15 miles from the apartment and Vieux Port Metro Station is 15 miles away.

The air-conditioned apartment is composed of 1 separate bedroom, a fully equipped",APARTMENT,43.2152067,5.5383415,168.0,USD,"Non-smoking rooms, Free Wifi, Beachfront, Family rooms, Private beach area",https://cf.bstatic.com/xdata/images/hotel/square60/486085353.jpg?k=06c5fa84cffa3c08f58da5cf6a12baa52d6c72445f4e3d80703a518cf42b66ac&o=
Cassis_15,Cassis,Studio rénové avec vue magique,https://www.booking.com/hotel/fr/studio-renove-avec-vue-magique.html?checkin=2025-12-11&checkout=2025-12-13&group_adults=2&no_rooms=1&group_children=&chal_t=1762888009558&force_referer=,8.1,29,"Offering a garden, Studio rénové avec vue magique offers accommodations in Cassis. This beachfront property offers access to a patio and free private parking. The apartment provides an outdoor swimming pool and full-day security.

Providing a balcony and sea views, the apartment includes 1 bedroom, a living room, flat-screen TV, an equipped kitchen, and 1 bathroom with a shower. The accommodation is non-smoking.

Guests can make the most of the warm weather with the property's barbecue facilitie",APARTMENT,43.219025355371,5.529711338231,189.0,USD,"Outdoor swimming pool, Non-smoking rooms, Beachfront, Free parking, Terrace",https://cf.bstatic.com/xdata/images/hotel/square60/435182042.jpg?k=04c100b87da3943004af9514b679a4576d03d467f2f5c2a697878a0b45724809&o=
Avignon_1,Avignon,Centre Palais des Papes B2 Clim - 123Avignon,https://www.booking.com/hotel/fr/centre-palais-des-papes-clim-123avignon.html?checkin=2025-12-11&checkout=2025-12-13&group_adults=2&no_rooms=1&group_children=&chal_t=1762886040616&force_referer=,9.1,50,"Centre Palais des Papes B2 Clim - 123Avignon in Avignon features accommodations with free Wifi, a 11-minute walk from Avignon Central Station, 3.2 miles from Avignon TGV Train Station, and 7 miles from Parc des Expositions Avignon. The property is around 25 miles from Arles Amphitheatre, 30 miles from Parc Expo Nîmes, and a 6-minute walk from Pont d'Avignon. The property is a 5-minute walk from Papal Palace and within 200 yards of the city center.

The apartment is composed of 2 separate bedroom",APARTMENT,43.949537613284,4.808402317791,169.0,USD,"Non-smoking rooms, Free Wifi, Non-smoking rooms, Free Wifi",https://cf.bstatic.com/xdata/images/hotel/square60/537289221.jpg?k=f527591b08f9247cb315d40b419d1a16a3a4345d0b6c1a00a8c153193c8e0f0c&o=
Avignon_2,Avignon,ibis Avignon Centre Gare,https://www.booking.com/hotel/fr/ibis-avignon-centre-gare.html?checkin=2025-12-11&checkout=2025-12-13&group_adults=2&no_rooms=1&group_children=,7.6,1114,"In the heart of Avignon, Ibis Avignon Center Gare is just 164 feet from the Avignon Train Station. It offers a 24-hour front desk, a bar, free WiFi and newspapers. Parking is available at the paid public parking area of the train station, located at the foot of the hotel.

The air-conditioned hotels rooms have a flat-screen TV with cable channels and a wardrobe. They all offer an private bathroom with a shower. Ironing facilities are also available.

A buffet breakfast composed of sweet and savo",HOTEL,43.94229069324134,4.807274341733546,133.0,USD,"Non-smoking rooms, Facilities for disabled guests, Room service, Free Wifi, Parking",https://cf.bstatic.com/xdata/images/hotel/max200/756924678.jpg?k=e4ddf371ecf9d475730dad78a5f80e40b9bd47e55139080c21a826ab667743be&o=
Avignon_3,Avignon,Régina Boutique Hotel,https://www.booking.com/hotel/fr/hotelreginaavignon.html?checkin=2025-12-11&checkout=2025-12-13&group_adults=2&no_rooms=1&group_children=,7.6,2321,"Régina is a hotel located on the main street in Avignon and just a 5-minute walk from the Palais des Papes.

The rooms are decorated in warm tones and also come with a flat-screen TV with satellite channels including Canal+, and a telephone. Free WiFi access is available and some rooms have a balcony. The private bathroom features a bath or shower.

A buffet breakfast is available every morning in the dining room.

Guests can also buy local produce on site, including jams, olive oil and biscuits",HOTEL,43.948165800766326,4.805764853954315,152.0,USD,"Non-smoking rooms, Free Wifi, Parking, Tea/Coffee Maker in All Rooms, Good Breakfast",https://cf.bstatic.com/xdata/images/hotel/max200/109792086.jpg?k=4e8d959e13521f5e8c21dcec8b159ce490cd4092d681b403b350c80fd635f5c1&o=
Avignon_4,Avignon,Hôtel Central,https://www.booking.com/hotel/fr/central-avignon.html?checkin=2025-12-11&checkout=2025-12-13&group_adults=2&no_rooms=1&group_children=,7.9,2595,"Located in the heart of the Old Town of Avignon, Hôtel Central offers comfortable guest rooms with free WiFi internet access. A garden and a bar are available on site.

All of the guest rooms are air-conditioned and have a TV and a private bathroom with bath or shower.

A continental breakfast with fresh fruit, French pastries and hot or cold beverages is available. It can be enjoyed on the flowered terrace in the summer months.

The Central Hotel is a 10-minute walk from the Palais des Papes an",HOTEL,43.945524956672806,4.805760830640793,132.0,USD,"Non-smoking rooms, Facilities for disabled guests, Room service, Free Wifi, Parking",https://cf.bstatic.com/xdata/images/hotel/square60/270296236.jpg?k=69ae12a8f7ec3e2e0c59e8faead18f8813f2fe86912cd41536c2eb3174717e48&o=
Avignon_5,Avignon,Garlande Hôtel Avignon Centre,https://www.booking.com/hotel/fr/de-garlande.html?checkin=2025-12-11&checkout=2025-12-13&group_adults=2&no_rooms=1&group_children=,8.8,700,"Featuring free WiFi, Garlande Hôtel Avignon Center offers accommodations set on a pedestrian street in Avignon, 1640 feet from Papal Palace and 2953 feet from Pont d'Avignon.

Each room is fitted with a flat-screen TV and a bath or shower. Certain rooms feature a seating area where you can relax.

Breakfast is available at the property for an additional charge. Evening meals can be served from Monday to Thursday if you reserve 24 hours in advance.

The property is a 10-minute walk from Avignon C",HOTEL,43.94761833011378,4.806803539395332,283.0,USD,"Non-smoking rooms, Airport shuttle, Facilities for disabled guests, Free Wifi, Very Good Breakfast",https://cf.bstatic.com/xdata/images/hotel/max200/545580779.jpg?k=9f817b1f05cb1d3b8176ec533a9141f155aa470fb8422321e03f23d9a397c8a4&o=
Avignon_6,Avignon,Hôtel Les Corps Saints,https://www.booking.com/hotel/fr/splendid-avignon.html?checkin=2025-12-11&checkout=2025-12-13&group_adults=2&no_rooms=1&group_children=&chal_t=1762886203506&force_referer=,7.5,1229,"Hôtel Les Corps Saints features a location facing Agricol Perdiguier Square in Avignon's historic city center, 5 minutes' walk from the train station. The rooms include free WiFi. Corps Saints Square is 262 feet from the hotel.

Only accessible by stairs, the rooms come with a TV and have a private bathroom with a shower.

For an additional fee, guests can enjoy a buffet breakfast with cheese, pastries, cold meat, jams, yogurt, boiled and hard boiled eggs. Another breakfast option called 'Bistro",HOTEL,43.944233090012354,4.806668758392334,105.0,USD,"Non-smoking rooms, Free Wifi, Family rooms, Very Good Breakfast, Non-smoking rooms",https://cf.bstatic.com/xdata/images/hotel/max200/87670701.jpg?k=590ecb592d758219a486e4d13ce73a017d7859cc9882dedcc11c900ff6b41e46&o=
Avignon_7,Avignon,La Saraillerie - PATIO - CLIM - WIFI,https://www.booking.com/hotel/fr/la-saraillerie-central-clim-wifi.html?checkin=2025-12-11&checkout=2025-12-13&group_adults=2&no_rooms=1&group_children=,8.6,80,"La Saraillerie - PATIO - CLIM - WIFI is located in Avignon, just a 7-minute walk from Avignon Central Station and 3.1 miles from Avignon TGV Train Station. This apartment offers accommodations with a terrace and free Wifi. The property is 200 yards from the city center and a 6-minute walk from Papal Palace.

The air-conditioned apartment consists of 1 bedroom, a living room, a fully equipped kitchen with an oven and a coffee machine, and 1 bathroom with an a bath or shower. A flat-screen TV is f",APARTMENT,43.9471806,4.8072535,223.0,USD,"Non-smoking rooms, Free Wifi, Family rooms, Non-smoking rooms, Free Wifi",https://cf.bstatic.com/xdata/images/hotel/square60/614189254.jpg?k=e838c7a1c69070ac9ed3df0b01d696e33aabceba3c90ff56ef80e5aaa0784ba8&o=
Avignon_8,Avignon,Appartements La Croix - Hyper Centre - Palais des Papes et Pont d'Avignon - WiFi,https://www.booking.com/hotel/fr/appartements-la-croix.html?checkin=2025-12-11&checkout=2025-12-13&group_adults=2&no_rooms=1&group_children=,8.1,658,"Located in Avignon, just 853 feet from the famous Pont d'Avignon, Appartements La Croix - Hyper Center - Palais des Papes et Pont d'Avignon - WiFi offers self-catering accommodations. The apartment features a dining area where guests can enjoy an evening meal after a day of exploring Avignon. Free WiFi access if provided throughout the apartment. Extra amenities include a washing machine and ironing facilities.

The apartment includes a seating area and a TV with cable channels. There is a fully",APARTMENT,43.95147165809491,4.8045851708045575,186.0,USD,"Non-smoking rooms, Facilities for disabled guests, Fast free Wifi 177 Mbps), Parking, Family rooms",https://cf.bstatic.com/xdata/images/hotel/square60/704368219.jpg?k=221e1ed6fb7c5427b0208337a4bd99e1367cb1628e48c7340f076aa6c176024b&o=
Avignon_9,Avignon,"Duplex-Ceiling height 1,9m-Free private parking-Self check in !! Duplex climatisé-Hauteur sous plafond 1,9m-Parking privé gratuit-Arrivée autonome !!",https://www.booking.com/hotel/fr/duplex-climatise-au-centre-ville-d-avignon-avec-parking-prive-gratuit.html?checkin=2025-12-11&checkout=2025-12-13&group_adults=2&no_rooms=1&group_children=&chal_t=1762886847527&force_referer=,9.7,128,"A 9-minute walk from Papal Palace in Avignon, Duplex-Ceiling height 1,9m-Free private parking-Self check in!! Duplex climatisé-Hauteur sous plafond 1,9m-Parking privé gratuit-Arrivée autonome!! provides accommodations with access to a hot tub. This property offers access to a balcony, free private parking, and free Wifi. The property is a 6-minute walk from Avignon Central Station and within 500 yards of the city center.

The air-conditioned apartment consists of 1 bedroom, a living room, a full",APARTMENT,43.9465116,4.8035118,448.0,USD,"Free Wifi, Free parking, Free Wifi, Free parking",https://cf.bstatic.com/xdata/images/hotel/square60/606260065.jpg?k=3556d875072e73ed5b76f48a2ccc3e5bb4c2e92ad91960bf3163cb969f4c1376&o=
Avignon_10,Avignon,Appartement Les Hortensias,https://www.booking.com/hotel/fr/les-hortensias-avignon.html?checkin=2025-12-11&checkout=2025-12-13&group_adults=2&no_rooms=1&group_children=&chal_t=1762886911900&force_referer=,9.2,58,"Located a 10-minute walk from the center of Avignon and just a 15-minute walk from the historic quarter with the Pope Palace, Les Hortensias is an elegant, spacious 2-bedroom apartment of 318 feet squared. It features a furnished terrace and a large living room with high ceilings, tiled flooring and an original fireplace.

The air-conditioned, spacious accommodations includes a flat-screen TV with an iPod Docking Station, a DVD Player and free WiFi access. The bathroom is fitted with a bathtub a",APARTMENT,43.94337669999999,4.819127299999991,344.0,USD,"Non-smoking rooms, Airport shuttle, Free Wifi, Free parking, Family rooms",https://cf.bstatic.com/xdata/images/hotel/square60/19622971.jpg?k=4367e31106baa535e50de810e4311660b31253f17621969687c408f96d62c224&o=
Avignon_11,Avignon,Apartment-NO elevator-Free private parking-Self check in !! Appartement-PAS ascenseur-Parking privé gratuit-Arrivée autonome!!,https://www.booking.com/hotel/fr/intramuros-parking-prive-wifi-smarttv50.html?checkin=2025-12-11&checkout=2025-12-13&group_adults=2&no_rooms=1&group_children=,9.6,158,"Apartment-NO elevator-Free private parking-Self check in!! Appartement-PAS ascenseur-Parking privé gratuit-Arrivée autonome!! offers accommodations in Avignon, a 16-minute walk from Papal Palace and 3.5 miles from Avignon TGV Train Station. This apartment provides free private parking, private check-in and check-out, and free Wifi. The property is half a mile from the city center and 1.1 miles from Avignon Central Station.

This apartment includes 1 bedroom, a living room and a flat-screen TV, a",APARTMENT,43.95092289445271,4.818413211967911,250.0,USD,"Free Wifi, Free parking, Free Wifi, Free parking",https://cf.bstatic.com/xdata/images/hotel/square60/690648133.jpg?k=ca13cf0daebddd074ef7e1856814da04ddc0c84a975c61c87db06684b37e582e&o=
Avignon_12,Avignon,Chambre et appartements entre le Pont d Avignon et le Palais des Papes,https://www.booking.com/hotel/fr/appartements-et-chambre-entre-le-pont-d-avignon-et-le-palais-des-papes.html?checkin=2025-12-11&checkout=2025-12-13&group_adults=2&no_rooms=1&group_children=&chal_t=1762887025185&force_referer=,8.3,695,"Chambre et appartements entre le Pont d Avignon et le Palais des Papes is an apartment featuring rooms with free Wifi and air conditioning in the center of Avignon. The property is around 2.7 miles from Avignon TGV Train Station, 7.3 miles from Parc des Expositions Avignon, and 25 miles from Arles Amphitheatre. There's private parking and the property provides an electric vehicle charging station.

At the apartment complex, each unit is equipped with a wardrobe, a flat-screen TV, a private bathr",APARTMENT,43.9507095,4.80338430000006,169.0,USD,"Non-smoking rooms, Free Wifi, Private Parking, Family rooms, Non-smoking rooms",https://cf.bstatic.com/xdata/images/hotel/square60/181101570.jpg?k=207eccdb618516111caa2dec7dec9312d1ef5933871bdd42f08ad6b703d95fbb&o=
Avignon_13,Avignon,L'Oriflamme,https://www.booking.com/hotel/fr/sutdio-quot-l-39-oriflamme-quot.html?checkin=2025-12-11&checkout=2025-12-13&group_adults=2&no_rooms=1&group_children=,9.5,431,"L'Oriflamme is an apartment featuring rooms with free Wifi and air conditioning in the center of Avignon. The property is around 3.6 miles from Avignon TGV Train Station, 7 miles from Parc des Expositions Avignon, and 26 miles from Arles Amphitheatre. Guests can access the apartment via private entrance.

All units are equipped with a terrace or a balcony, a seating area, a flat-screen TV, DVD player, a well-equipped kitchen, and a private bathroom with shower and a hair dryer. An oven, a microw",APARTMENT,43.9496041,4.81154160000006,136.0,USD,"Non-smoking rooms, Free Wifi, Free parking, Family rooms, Non-smoking rooms",https://cf.bstatic.com/xdata/images/hotel/square60/253428187.jpg?k=b433b87ce10eb39834c76a147ef00e7196421ef4174a6dec36aad5e2f6b7f158&o=
Avignon_14,Avignon,Les Précieuses Suites & Spa II,https://www.booking.com/hotel/fr/les-precieuses-suites-amp-spa-ii.html?checkin=2025-12-11&checkout=2025-12-13&group_adults=2&no_rooms=1&group_children=,9.5,104,"A 8-minute walk from Papal Palace in the center of Avignon, Les Précieuses Suites & Spa II offers accommodations with access to spa facilities. The air-conditioned accommodation is a 10-minute walk from Avignon Central Station. The accommodation provides a hot tub, free Wifi throughout the property, and a 24-hour front desk.

Providing garden views, this apartment also offers a cable flat-screen TV, a well-equipped kitchenette with a microwave, a fridge, and a stovetop, as well as 1 bathroom wit",APARTMENT,43.9485731,4.8015495999999995,389.0,USD,"Non-smoking rooms, Spa, Free Wifi, Free parking, 24-hour front desk",https://cf.bstatic.com/xdata/images/hotel/square60/373982269.jpg?k=4cf2e2dd96d8fca7e863232bfaeb5c530e2d3f7866acce35b457edd5064ab428&o=
Avignon_15,Avignon,Le Vieux Sextier - AC Clim - Lumineux - WIFI - Hypercentre,https://www.booking.com/hotel/fr/le-vieux-sextier-lumineux-wifi-hyper-centre.html?checkin=2025-12-11&checkout=2025-12-13&group_adults=2&no_rooms=1&group_children=&chal_t=1762887757227&force_referer=,8.4,24,"Le Vieux Sextier - AC Clim - Lumineux - WIFI - Hypercentre offers accommodations in Avignon, a 9-minute walk from Avignon Central Station and 3.1 miles from Avignon TGV Train Station. Featuring city views, this apartment also features free Wifi. The property is a few steps from the city center and a 7-minute walk from Papal Palace.

This apartment includes 3 bedrooms, a living room and a flat-screen TV, an equipped kitchen with a dining area, and 2 bathrooms with a walk-in shower and a washing m",APARTMENT,43.9481906,4.808427,736.0,USD,"Non-smoking rooms, Free Wifi, Family rooms, Non-smoking rooms, Free Wifi",https://cf.bstatic.com/xdata/images/hotel/square60/411460450.jpg?k=8fd405b8db7b5d904c6bf887c7c2d5f0abb693d554a7184a84f69a6cb98a6d22&o=
