hotel_id,city,hotel_name,url,score,number_of_reviews,description,property_type,latitude,longitude,price,currency,facilities,image_url
Aix en Provence_1,Aix en Provence,Aparthotel Adagio Aix-en-Provence Centre,https://www.booking.com/hotel/fr/pierre-vacances-city-centre.html?checkin=2025-12-11&checkout=2025-12-13&group_adults=2&no_rooms=1&group_children=,8.5,1916,"Ideally located on a peaceful street in the center of Aix-en-Provence, this residence is a 10-minute walk from the cafés and fountains on Cours Mirabeau. Gare d’Aix-en-Provence is 2953 feet away. Free WiFi is available in all areas.

Apartments and studios at Aparthotel Adagio Aix en Provence Center are contemporary in style and offer an LCD TV. All have a kitchen with hotplates and some have a separate bedroom.

Breakfast and drinks and snacks vending machines are some of the other facilities o",APARTHOTEL,43.52890621393209,5.440869033336639,221.0,USD,"Non-smoking rooms, Facilities for disabled guests, Free Wifi, Private Parking, Family rooms",https://cf.bstatic.com/xdata/images/hotel/square60/700052649.jpg?k=826f47de3b1d05ca5d219620f2672d077b218b60bab64d02fa67ca4fd29fceb5&o=
Aix en Provence_2,Aix en Provence,Best Western Hotel le Galice Aix-en-Provence,https://www.booking.com/hotel/fr/best-western-le-galice.html?checkin=2025-12-11&checkout=2025-12-13&group_adults=2&no_rooms=1&group_children=&chal_t=1762886088164&force_referer=,8.0,2637,"Located a 10-minute walk from the center of Aix-en-Provence, Best Western Le Galice Center Ville features a seasonal outdoor pool and a terrace. Free WiFi is available throughout the property.

The air-conditioned rooms are equipped with a flat-screen satellite TV, a desk, a kettle and a mini-bar. The private bathrooms have a bath or shower and a hairdryer.

The hotel has business facilities, including fully equipped meeting rooms open 24 hours a day, 7 days a week. There is also a 24-hour recep",HOTEL,43.528031104306436,5.434359312057495,233.0,USD,"Outdoor swimming pool, Non-smoking rooms, Facilities for disabled guests, Restaurant, Free Wifi",https://cf.bstatic.com/xdata/images/hotel/max200/167333322.jpg?k=b94eabcce4dd61fd2eb96722f7bc318b4b91749f2ac13ebf09ad38a7c51413a8&o=
Aix en Provence_3,Aix en Provence,B&B HOTEL Aix-en-Provence Pont de l'Arc,https://www.booking.com/hotel/fr/b-amp-b-aix-en-provence-pont-de-l-39-arc.html?checkin=2025-12-11&checkout=2025-12-13&group_adults=2&no_rooms=1&group_children=&chal_t=1762886081839&force_referer=,7.5,2164,"Offering free WiFi, B&B HÃ´tel Aix-en-Provence Pont de l'Arc is located in Aix-en-Provence. This 2-star hotel has air-conditioned rooms with a private bathroom. Cours Mirabeau is 1.4 mi from the hotel.

Accessed via a staircase, all guest rooms in the hotel are equipped with a flat-screen TV.

A buffet breakfast is served every morning at the property. A shared microwave is available to guests as well as a vending machine for drinks and snacks.

Saint-Sauveur Cathedral is 1.7 mi from B&B HÃ´tel ",HOTEL,43.5111713,5.4446805,128.0,USD,"Non-smoking rooms, Free Wifi, Free parking, Family rooms, Good Breakfast",https://cf.bstatic.com/xdata/images/hotel/max200/156383418.jpg?k=ac4e250369024d0138bfaa67dd94a5745b6363ed8174a10704600c336c0ff443&o=
Aix en Provence_4,Aix en Provence,Villa Saint-Ange,https://www.booking.com/hotel/fr/villa-saint-ange.html?checkin=2025-12-11&checkout=2025-12-13&group_adults=2&no_rooms=1&group_children=,9.3,370,"Set 2625 ft from Cours Mirabeau in Aix-en-Provence, Villa Saint-Ange hotel features a heated outdoor swimming pool, a Provencal garden, and a French restaurant and bar with a terrace. This property is 1.4 mi from Saint-Sauveur Cathedral.

Rooms are spread across five 18th-century bastide-style cottages, decorated in the style of an Aix-en-Provence town house. All rooms include air conditioning, a flat-screen TV with international channels, a safety deposit box, and a mini-bar. The private bathro",HOTEL,43.523068,5.457699,752.0,USD,"Outdoor swimming pool (temporarily closed), Non-smoking rooms, Spa, Airport shuttle, Fitness center",https://cf.bstatic.com/xdata/images/hotel/max200/579625086.jpg?k=86c519b590369cc34dc4a14257d91dbf1f4d28c883a9c711d3b5e9d4657fa241&o=
Aix en Provence_5,Aix en Provence,Le Concorde,https://www.booking.com/hotel/fr/le-concorde-sarl-aix-en-provence.html?checkin=2025-12-11&checkout=2025-12-13&group_adults=2&no_rooms=1&group_children=,8.0,2267,"Le Concorde is ideally located in the center of Aix-en-Provence, only a 5-minute walk from the famous Cour Mirabeau and near the Granet Museum. It offers a flowered garden.

The guest rooms all feature a TV, air-conditioning and Wi-Fi access.

You can start the day with a generous breakfast in the breakfast room or in the courtyard.

For guests arriving by car, the hotel has a large private garage in the basement available for an additional charge, allowing you to explore the city without any pa",HOTEL,43.524612221014486,5.453754365444183,260.0,USD,"Non-smoking rooms, Facilities for disabled guests, Free Wifi, Private Parking, Family rooms",https://cf.bstatic.com/xdata/images/hotel/square60/231223040.jpg?k=9d63f2480250e7e57c72ae9067819ef22508c716292033053cf487e33a4b660b&o=
Aix en Provence_6,Aix en Provence,Les Suites du Cours & Spa,https://www.booking.com/hotel/fr/les-suites-du-cours.html?checkin=2025-12-11&checkout=2025-12-13&group_adults=2&no_rooms=1&group_children=,9.2,377,"Set in Aix-en-Provence in Cours Mirabeau, Les Suites du Cours & Spa features a spa center. Saint-Sauveur Cathedral is 1969 feet away. Free WiFi is featured throughout the property.

All units feature air conditioning and a flat-screen TV. There is a seating and/or dining area in some units. There is also a kitchen complete with a dishwasher and oven. A toaster, a fridge and stovetop are also offered, as well as a coffee machine and a kettle. Each unit is fitted with a private bathroom with a bat",APARTMENT,43.5269723441162,5.44928753701095,398.0,USD,"Non-smoking rooms, Spa, Free Wifi, Parking, Family rooms",https://cf.bstatic.com/xdata/images/hotel/square60/90257494.jpg?k=77625e8930fca555d787d4f39aff3b2cd3782f5bda3d8810e2c552f1cd76a5ac&o=
Aix en Provence_7,Aix en Provence,Hotel Cardinal,https://www.booking.com/hotel/fr/cardinal.html?checkin=2025-12-11&checkout=2025-12-13&group_adults=2&no_rooms=1&group_children=&chal_t=1762886394488&force_referer=,8.6,1481,"Located in Aix-en-Provence, 19 miles from Joliette Metro Station, Hotel Cardinal features views of the city. The 2-star hotel has air-conditioned rooms with a private bathroom and free WiFi. The property is 400 yards from the city center and 19 miles from Marseille Saint-Charles Train Station.

At the hotel, the rooms include a desk. Selected rooms also feature a kitchenette with a fridge, a microwave and a stovetop. All rooms in Hotel Cardinal are equipped with a flat-screen TV and free toiletr",HOTEL,43.5255987,5.45172079999998,313.0,USD,"Non-smoking rooms, Free Wifi, Good Breakfast, Non-smoking rooms, Free Wifi",https://cf.bstatic.com/xdata/images/hotel/square60/120237817.jpg?k=600b321407d200cd7767983acab5e07284cea064c7ac5fc8953353975e21d1b1&o=
Aix en Provence_8,Aix en Provence,Campanile Prime - Aix-en-Provence Sud - Pont de l'Arc,https://www.booking.com/hotel/fr/campanile-aix-en-provence-sud.html?checkin=2025-12-11&checkout=2025-12-13&group_adults=2&no_rooms=1&group_children=,7.8,3003,"Located in Aix-en-Provence, 1.9 mi from the historical center and Cours Mirabeau, Campanile Aix-en-Provence Sud - Pont de l'Arc offers air-conditioned rooms with free WiFi.

Each of the guest rooms is equipped with a flat-screen TV. Tea and coffee making facilities are available in each room.

A buffet breakfast is served each morning at the hotel. The hotel's restaurant serves contemporary French cuisine that can be enjoyed on the terrace during the summer months. Campanile Aix-en-Provence also",HOTEL,43.511916316958825,5.436653941869736,155.0,USD,"Non-smoking rooms, Facilities for disabled guests, Restaurant, Free Wifi, Free parking",https://cf.bstatic.com/xdata/images/hotel/square60/751834363.jpg?k=dbc2dc9a3a5c2d72596c6305612bf31d34b7ac4a62615afd1b320b8983eb8ae9&o=
Aix en Provence_9,Aix en Provence,Domaine de Saint Clair,https://www.booking.com/hotel/fr/domaine-de-saint-clair.html?checkin=2025-12-11&checkout=2025-12-13&group_adults=2&no_rooms=1&group_children=,9.6,187,"Domaine de Saint Clair is an adults-only Bed&Breakfast located just 2.1 mi (10 minutes) from the historic center of Aix-en-Provence.

The guest rooms at Domaine de Saint Clair are located in a Provençal house, independent of the mansion. The Domaine de Saint Clair offers only 3 spacious suites to guarantee peace and privacy, in a privileged setting. The suites of 30 m2 each are recently restored and warmly decorated.

The house is fully air-conditioned and has free Wi-Fi internet access.

All su",BED_AND_BREAKFAST,43.4991564242671,5.43205648570552,561.0,USD,"Outdoor swimming pool, Non-smoking rooms, Free Wifi, Free parking, Terrace",https://cf.bstatic.com/xdata/images/hotel/max200/114058092.jpg?k=e92a1d420266772e87288bb038651fd9ec0b4ec93449d390267bc980c4687c0e&o=
Aix en Provence_10,Aix en Provence,Adonis Arc Hotel Aix,https://www.booking.com/hotel/fr/arc-aix-hotel.html?checkin=2025-12-11&checkout=2025-12-13&group_adults=2&no_rooms=1&group_children=,7.6,1414,"Set in the heart of the Provence region, Adonis Arc Hotel Aix is fully air-conditioned and is located a 5-minute drive from Aix-en-Provence city center. It features a seasonal outdoor pool and a terrace. Free WiFi is provided throughout.

All of the rooms have a private bathroom equipped with a bathtub. They feature a desk, flat-screen TV and telephone.

Adonis Arc Hotel Aix provides daily buffet breakfast. There is a bar and you can enjoy a drink by the pool. Deckchairs are also at your disposa",HOTEL,43.51371445304431,5.470212399959564,160.0,USD,"Outdoor swimming pool (temporarily closed), Non-smoking rooms, Facilities for disabled guests, Free Wifi, Private Parking",https://cf.bstatic.com/xdata/images/hotel/max200/762653131.jpg?k=86ed6a9258f63dd90cee085e9d72708ee34d2324c1a43fbba0ec0596c968486a&o=
Aix en Provence_11,Aix en Provence,Terrasse & Spa dans Aix Hypercentre,https://www.booking.com/hotel/fr/waves-house.html?checkin=2025-12-11&checkout=2025-12-13&group_adults=2&no_rooms=1&group_children=,8.8,29,"Waves House is located in Aix-en-Provence, just 19 miles from Marseille Saint-Charles Train Station and 19 miles from Joliette Metro Station. The property is around 19 miles from Les Terrasses du Port Shopping Center, 19 miles from Vieux Port Metro Station, and 19 miles from Museum of European and Mediterranean Civilisations. The accommodation offers a hot tub, free Wifi throughout the property, and an elevator.

Featuring garden and city views, this apartment features 1 bedroom and opens to a t",APARTMENT,43.5255712,5.4423252,303.0,USD,"Non-smoking rooms, Free Wifi, Terrace, Non-smoking rooms, Free Wifi",https://cf.bstatic.com/xdata/images/hotel/square60/527955796.jpg?k=6482ec572ddf1e08ff856437bb497e68276218065b530ff5c37af4cd4553e985&o=
Aix en Provence_12,Aix en Provence,Studio climatisé plein centre 4eme étage,https://www.booking.com/hotel/fr/studio-plein-centre-3eme-etage.html?checkin=2025-12-11&checkout=2025-12-13&group_adults=2&no_rooms=1&group_children=&chal_t=1762886886874&force_referer=,8.4,24,"Studio climatisé plein centre 4eme étage is located in Aix-en-Provence, just 19 miles from Joliette Metro Station and 20 miles from Les Terrasses du Port Shopping Center. Featuring city views, this apartment also has free Wifi. The property is 300 yards from the city center and 19 miles from Marseille Saint-Charles Train Station.

This air-conditioned apartment comes with a dining area, a fully equipped kitchenette with a fridge, and a TV. The accommodation is non-smoking.

Vieux Port Metro Stat",APARTMENT,43.5302425,5.4470586,174.0,USD,"Non-smoking rooms, Free Wifi, Non-smoking rooms, Free Wifi",https://cf.bstatic.com/xdata/images/hotel/square60/716217563.jpg?k=4084d11747d4382eab681f435842e71f75ae84fa0b62dc9ceae26df06324d1f9&o=
Aix en Provence_13,Aix en Provence,Lou Pitchoun,https://www.booking.com/hotel/fr/lou-pitchoun-aix-en-provence.html?checkin=2025-12-11&checkout=2025-12-13&group_adults=2&no_rooms=1&group_children=&chal_t=1762887522922&force_referer=,8.5,101,"Lou Pitchoun in Aix-en-Provence provides accommodations with free Wifi, 19 miles from Joliette Metro Station, 20 miles from Les Terrasses du Port Shopping Center, and 20 miles from Vieux Port Metro Station. The property is around 20 miles from Museum of European and Mediterranean Civilisations, 20 miles from Castellane Metro Station, and 20 miles from Saint-Ferreol Street. The property is 19 miles from Marseille Saint-Charles Train Station and within 400 yards of the city center.

The air-condit",APARTMENT,43.5310473,5.4495993,247.0,USD,"Non-smoking rooms, Free Wifi, Non-smoking rooms, Free Wifi",https://cf.bstatic.com/xdata/images/hotel/square60/694577345.jpg?k=2f3a343bd90b0e4f8d2f9dc2972c4e4a744df473624930f80b32150666c89b97&o=
Aix en Provence_14,Aix en Provence,La Villa Rustica,https://www.booking.com/hotel/fr/la-villa-rustica.html?checkin=2025-12-11&checkout=2025-12-13&group_adults=2&no_rooms=1&group_children=&chal_t=1762887750037&force_referer=,9.8,66,"A recently renovated vacation home, La Villa Rustica offers accommodations in Aix-en-Provence. This property offers access to a terrace, free private parking, and free Wifi. Outdoor seating is also available at the vacation home.

The air-conditioned vacation home consists of 1 bedroom, a living room, a fully equipped kitchen with a dishwasher and a coffee machine, and 1 bathroom with a shower and slippers. Towels and bed linen are offered in the vacation home. For added privacy, the accommodati",HOLIDAY_HOME,43.5587933,5.4488615,234.0,USD,"Non-smoking rooms, Free Wifi, Free parking, Terrace, Garden",https://cf.bstatic.com/xdata/images/hotel/square60/588123071.jpg?k=beb76014429052f24ba50b1959a8a71681232a1bbf653ca4e17715c2a784e0da&o=
Aix en Provence_15,Aix en Provence,La Gracette,https://www.booking.com/hotel/fr/la-gracette.html?checkin=2025-12-11&checkout=2025-12-13&group_adults=2&no_rooms=1&group_children=&chal_t=1762887784311&force_referer=,8.5,68,"La Gracette offers air-conditioned accommodations in Aix-en-Provence. This property offers access to a terrace and free private parking. Outdoor seating is also available at the bed and breakfast.

At the bed and breakfast, the units include a wardrobe. The rooms include a coffee machine, a private bathroom, and free Wifi, while selected rooms also offer a balcony and some have garden views. The rooms are equipped with heating facilities.

Guests at La Gracette can enjoy hiking nearby, or make t",BED_AND_BREAKFAST,43.490778,5.383993,249.0,USD,"Non-smoking rooms, Free Wifi, Free parking, Family rooms, Garden",https://cf.bstatic.com/xdata/images/hotel/max200/161928568.jpg?k=78d428945e246427e407b1e9d0bbd4bc96176f8cce2b0087bd1114cda209aeef&o=
Marseille_1,Marseille,Novotel Marseille Centre Prado Vélodrome,https://www.booking.com/hotel/fr/novotel-marseille-centre-prado.html?checkin=2025-12-11&checkout=2025-12-13&group_adults=2&no_rooms=1&group_children=&chal_t=1762886130477&force_referer=,8.0,1330,"Novotel Marseille Center Prado is located in one of Marseilles’ business districts. It is 164 feet from the Périer Metro Station providing access to all areas of the city, and 0.9 mi from the Orange Velodrome Stadium.

Air-conditioned guest rooms feature a flat-screen TV with satellite channels and a mini-fridge. There are also facilities for making tea and coffee, and the bathrooms include a hairdryer and free toiletries. Free Wi-Fi access is provided.

The restaurant Novotel Café offers a menu",HOTEL,43.28068115402996,5.387088060379028,281.0,USD,"Non-smoking rooms, Facilities for disabled guests, Room service, Restaurant, Free Wifi",https://cf.bstatic.com/xdata/images/hotel/max200/773306381.jpg?k=aee877a6949cb335839b45de736fe99e329bd83faaae440799eecb6c83795f26&o=
Marseille_2,Marseille,RockyPop Marseille Hôtel,https://www.booking.com/hotel/fr/citadines-aparthotel-marseilleprado.html?checkin=2025-12-11&checkout=2025-12-13&group_adults=2&no_rooms=1&group_children=&chal_t=1762886125651&force_referer=,9.1,277,"Located in Marseille, a 5-minute walk from Castellane Metro Station, RockyPop Marseille Hôtel provides accommodations with a terrace, private parking, a restaurant and a bar. With free WiFi, this 4-star hotel offers room service and a 24-hour front desk. The hotel features family rooms.

Each room has a safety deposit box, while selected rooms are equipped with a balcony. Guest rooms in the hotel are equipped with a flat-screen TV and a hairdryer.

RockyPop Marseille Hôtel offers a buffet or con",HOTEL,43.28282806447971,5.387259051203728,252.0,USD,"Non-smoking rooms, Facilities for disabled guests, Room service, Restaurant, Free Wifi",https://cf.bstatic.com/xdata/images/hotel/max200/727472890.jpg?k=db248be1c88ed723ebd211772de3a06438dfa2af408898b52126324c15ff4711&o=
Marseille_3,Marseille,Hôtel Ligo by HappyCulture,https://www.booking.com/hotel/fr/ligo-by-happyculture-marseille4.html?checkin=2025-12-11&checkout=2025-12-13&group_adults=2&no_rooms=1&group_children=,7.9,1175,"Attractively set in Marseille, Hôtel Ligo by HappyCulture has a buffet breakfast and free WiFi throughout the property. This 4-star hotel offers luggage storage space. The hotel has family rooms.

Complete with a private bathroom equipped with a bath, the rooms at the hotel have a flat-screen TV and air conditioning, and certain rooms contain a terrace. All guest rooms will provide guests with a closet and an electric tea pot.

Speaking English and French at the 24-hour front desk, staff are rea",HOTEL,43.301265,5.370879,186.0,USD,"Non-smoking rooms, Free Wifi, Family rooms, 24-hour front desk, Elevator",https://cf.bstatic.com/xdata/images/hotel/square60/651552174.jpg?k=39166721da21204ad9e37421989a1df2600e63c2c83e3fb2ef8d12f606b17685&o=
Marseille_4,Marseille,Aparthotel Adagio Access Marseille Prado Périer,https://www.booking.com/hotel/fr/citea-marseille-prado-perier.html?checkin=2025-12-11&checkout=2025-12-13&group_adults=2&no_rooms=1&group_children=&chal_t=1762886238254&force_referer=,8.2,2014," Aparthotel Adagio Access Marseille Prado Périer is located in a residential district, 2461 feet from the Palais des Congrès and 0.6 mi from the Velodrome Stadium. This aparthotel offers an indoor swimming pool. Perier Metro Station is just 492 feet away and WiFi access is free.

A fully-equipped kitchen equipped with hotplates is a standard facility in the accommodations at Aparthotel Adagio Access Marseille Prado Périer. All studios and apartments have an LCD TV and some have a separate bedroo",APARTHOTEL,43.278692338557065,5.388060361146927,149.0,USD,"Non-smoking rooms, Facilities for disabled guests, Free Wifi, Family rooms, Elevator",https://cf.bstatic.com/xdata/images/hotel/max200/750929394.jpg?k=8123c2d0d21194414d01f6f70d2cf9e7922007030a4f4760f640ce4565871a5f&o=
Marseille_5,Marseille,B&B HOTEL Marseille Parc Chanot,https://www.booking.com/hotel/fr/ibis-budget-marseille-prado.html?checkin=2025-12-11&checkout=2025-12-13&group_adults=2&no_rooms=1&group_children=&chal_t=1762886313825&force_referer=,7.0,1997,"The B&B Hotel Marseille Parc Chanot is located in Marseille. Free Wi-Fi is available throughout the property. Each room is equipped with air conditioning and satellite TV. The private bathroom is equipped with a shower. Ironing facilities are also provided.

At the B&B Hotel Marseille Parc Chanot, you will find a 24-hour front desk and a terrace. You can purchase drinks from the vending machine.

Access to our hotel is via 7 Boulevard Latil, 13008 Marseille.

Access at the Total Station level is",HOTEL,43.274565370146355,5.393511426914188,119.0,USD,"Non-smoking rooms, Facilities for disabled guests, Free Wifi, Private Parking, 24-hour front desk",https://cf.bstatic.com/xdata/images/hotel/square60/536156077.jpg?k=f68104711925488487adf4f20198cb5fcb240e7f4a4c1e806c7a9b9dd5b98964&o=
Marseille_6,Marseille,Les Bords De Mer,https://www.booking.com/hotel/fr/les-bords-de-mer.html?checkin=2025-12-11&checkout=2025-12-13&group_adults=2&no_rooms=1&group_children=,8.9,248,"Located in Marseille, 1312 feet from Palais du Pharo, Les Bords De Mer has a number of amenities including   a seasonal outdoor swimming pool. The property is close to several noted attractions, around 2953 feet from Museum of European and Mediterranean Civilizations and around a 17-minute walk from Noter-Dame de la Garde Basilica.

The rooms are equipped with a private bathroom with a shower. Most rooms have a balcony and sea view. At Les Bords De Mer every room comes with air conditioning and ",HOTEL,43.28959,5.354999,725.0,USD,"2 swimming pools, Non-smoking rooms, Spa, Airport shuttle, Facilities for disabled guests",https://cf.bstatic.com/xdata/images/hotel/max200/560549712.jpg?k=ad93c90cc368fd52fcab5d533bf3937303ec39535eccd05c9e914ced9c92d407&o=
Marseille_7,Marseille,ADIRA Résid'Marseille Vieux-port 2 étoiles,https://www.booking.com/hotel/fr/adira-resid-marseille-vieux-port.html?checkin=2025-12-11&checkout=2025-12-13&group_adults=2&no_rooms=1&group_children=,8.4,475,"ADIRA Résid'Marseille Vieux-port 2 étoiles is a recently renovated apartment in the center of Marseille, 1.2 miles from Plage des Catalans and a 4-minute walk from Vieux Port Metro Station. With free Wifi, this 2-star apartment offers an elevator and full-day security. The property is close to popular attractions like Joliette Metro Station, Museum of European and Mediterranean Civilisations, and Notre Dame de la Garde Basilica.

All units at the apartment complex come with air conditioning, a s",APARTMENT,43.294458339908,5.377619730094,291.0,USD,"Non-smoking rooms, Free Wifi, Parking, Family rooms, Elevator",https://cf.bstatic.com/xdata/images/hotel/square60/442969916.jpg?k=200cbe6de9aec3358bdbe42fc496dfdb82a988aa0cbd1097bf965bdc042e8a31&o=
Marseille_8,Marseille,Résidence Kley Marseille République,https://www.booking.com/hotel/fr/residence-kley-marseille-republique.html?checkin=2025-12-11&checkout=2025-12-13&group_adults=2&no_rooms=1&group_children=&chal_t=1762886743416&force_referer=,7.5,314,"Résidence Kley Marseille République in Marseille offers accommodations with free Wifi, a 10-minute walk from Vieux Port Metro Station, 600 yards from Joliette Metro Station, and a 9-minute walk from Les Terrasses du Port Shopping Center. The property is around 1.5 miles from Castellane Metro Station, 1.9 miles from Palais du Pharo, and 1.9 miles from Notre Dame de la Garde Basilica. The property is 1.6 miles from Plage des Catalans and within 0.7 miles of the city center.

The condo hotel is com",APARTHOTEL,43.3010928,5.3699198,164.0,USD,"Non-smoking rooms, Free Wifi, Non-smoking rooms, Free Wifi",https://cf.bstatic.com/xdata/images/hotel/square60/611048444.jpg?k=94a6a2e025df18cd9c220d147ce468f2751df350b0f144694adb7a3b13d1d5ac&o=
Marseille_9,Marseille,Aparthotel Adagio Access Marseille Prado Périer,https://www.booking.com/hotel/fr/citea-marseille-prado-perier.html?checkin=2025-12-11&checkout=2025-12-13&group_adults=2&no_rooms=1&group_children=&chal_t=1762886834666&force_referer=,8.2,2014," Aparthotel Adagio Access Marseille Prado Périer is located in a residential district, 2461 feet from the Palais des Congrès and 0.6 mi from the Velodrome Stadium. This aparthotel offers an indoor swimming pool. Perier Metro Station is just 492 feet away and WiFi access is free.

A fully-equipped kitchen equipped with hotplates is a standard facility in the accommodations at Aparthotel Adagio Access Marseille Prado Périer. All studios and apartments have an LCD TV and some have a separate bedroo",APARTHOTEL,43.278692338557065,5.388060361146927,149.0,USD,"Non-smoking rooms, Facilities for disabled guests, Free Wifi, Family rooms, Elevator",https://cf.bstatic.com/xdata/images/hotel/max200/750929394.jpg?k=8123c2d0d21194414d01f6f70d2cf9e7922007030a4f4760f640ce4565871a5f&o=
Marseille_10,Marseille,Maison Galante au Vieux Port,https://www.booking.com/hotel/fr/maison-galante-au-vieux-port.html?checkin=2025-12-11&checkout=2025-12-13&group_adults=2&no_rooms=1&group_children=,8.8,83,"Maison Galante au Vieux Port features rooms with free Wifi in the center of Marseille. This recently renovated condo hotel is located a 17-minute walk from Plage des Catalans and 300 yards from Vieux Port Metro Station. Guests can access the condo hotel via private entrance.

The units at the condo hotel come with air conditioning, a seating area, a flat-screen TV with satellite channels, a kitchen, a dining area, a safety deposit box, and a private bathroom with a walk-in shower, slippers, and ",APARTHOTEL,43.293512,5.372234,373.0,USD,"Non-smoking rooms, Beachfront, Free Wifi, Parking, Terrace",https://cf.bstatic.com/xdata/images/hotel/square60/637569540.jpg?k=0a79ae38acf9e9cbf18faceae68edfba6ed5b026142f7987c708f8ed7f2f85bc&o=
